{
  "schema_version": "1.0",
  "project": "Nexora",
  "rule": "AI-native development orchestration units are pre-planned under AI-GOV-AUTOMATION-100. They are planning commitments, not runtime implementation claims.",
  "units": [
    {
      "id": "SYS-AI-DEV-ORCHESTRATION",
      "type": "core-system",
      "name": "AI Development Orchestration",
      "summary": "Governed lifecycle for AI-assisted planning, implementation, review, verification, attestation and promotion.",
      "status": "PLANNED",
      "parent_stage_id": "AI-GOV-AUTOMATION-100",
      "release_train": "builder-beta",
      "depends_on": ["CORE-QA-001"],
      "security": {"risk": "critical", "threat_model_required": true},
      "acceptance_criteria": ["AI development cannot skip registered scope, exact-head verification, required review/evidence or promotion gates."]
    },
    {
      "id": "SYS-AI-INSTRUCTION-TRUST",
      "type": "security-control",
      "name": "Development Instruction Trust Boundary",
      "summary": "Treat repository/external task artifacts as untrusted data and prevent prompt/instruction injection from widening agent authority.",
      "status": "PLANNED",
      "parent_stage_id": "AI-GOV-AUTOMATION-100",
      "release_train": "builder-beta",
      "depends_on": ["SYS-AI-DEV-ORCHESTRATION"],
      "security": {"risk": "critical", "threat_model_required": true},
      "acceptance_criteria": ["Issue/source/log/README/web content cannot override repository governance or grant secrets/network/tool authority."]
    },
    {
      "id": "SYS-AI-RUN-MANIFEST",
      "type": "core-system",
      "name": "AI Development Run Manifest",
      "summary": "Pin run identity, exact base SHA, plan/policy digests, role, scope, budgets, tool/path/network capabilities and reviewer requirements.",
      "status": "PLANNED",
      "parent_stage_id": "AI-GOV-AUTOMATION-100",
      "release_train": "builder-beta",
      "depends_on": ["SYS-AI-DEV-ORCHESTRATION"],
      "security": {"risk": "high", "threat_model_required": true},
      "acceptance_criteria": ["Material head/plan/policy drift marks a run stale before further mutation or promotion."]
    },
    {
      "id": "SYS-AI-SCOPE-LEASE",
      "type": "core-system",
      "name": "Scope Lease & Concurrent Writer Control",
      "summary": "Branch/worktree/path ownership, optimistic concurrency, lease expiry and multi-agent write-conflict protection.",
      "status": "PLANNED",
      "parent_stage_id": "AI-GOV-AUTOMATION-100",
      "release_train": "builder-beta",
      "depends_on": ["SYS-AI-RUN-MANIFEST"],
      "security": {"risk": "high", "threat_model_required": true},
      "acceptance_criteria": ["Two agents cannot silently overwrite the same protected file/migration/state from stale bases."]
    },
    {
      "id": "SYS-AI-EXECUTION-SANDBOX",
      "type": "security-control",
      "name": "Development Tool Capability Sandbox",
      "summary": "Least-privilege write, shell, package, network, secret, repository, workflow and target capabilities for development agents.",
      "status": "PLANNED",
      "parent_stage_id": "AI-GOV-AUTOMATION-100",
      "release_train": "builder-beta",
      "depends_on": ["SYS-AI-RUN-MANIFEST", "SYS-AI-INSTRUCTION-TRUST"],
      "security": {"risk": "critical", "threat_model_required": true},
      "acceptance_criteria": ["Generic development execution cannot imply unrestricted secrets, network, governance, repository-settings or production mutation authority."]
    },
    {
      "id": "SEC-AI-GOVERNANCE-SELF-PROTECTION",
      "type": "security-control",
      "name": "Governance Self-Modification Guard",
      "summary": "Prevent AI changes from weakening the policy/workflow/checks used to judge the same change without separate governed review.",
      "status": "PLANNED",
      "parent_stage_id": "AI-GOV-AUTOMATION-100",
      "release_train": "builder-beta",
      "depends_on": ["SYS-AI-EXECUTION-SANDBOX"],
      "security": {"risk": "critical", "threat_model_required": true},
      "acceptance_criteria": ["Fail→warn, check removal, protected-path policy weakening and repository-ruleset changes require explicit governance scope and independent approval."]
    },
    {
      "id": "SYS-AI-TEST-INTEGRITY",
      "type": "core-system",
      "name": "AI Test Oracle Integrity",
      "summary": "Protect critical tests/invariants from AI weakening and separate implementation authorship from independent verification for high-risk paths.",
      "status": "PLANNED",
      "parent_stage_id": "AI-GOV-AUTOMATION-100",
      "release_train": "builder-beta",
      "depends_on": ["SYS-AI-DEV-ORCHESTRATION"],
      "security": {"risk": "high", "threat_model_required": true},
      "acceptance_criteria": ["Deleted/skipped/weakened assertions are review-visible and critical green status cannot rely solely on tests authored/relaxed by the implementation run."]
    },
    {
      "id": "SYS-EVIDENCE-ATTESTATION",
      "type": "security-control",
      "name": "Evidence Integrity & Attestation",
      "summary": "Exact-source machine evidence envelopes, immutable supersession, producer/run/target identity and SLSA-compatible artifact provenance.",
      "status": "PLANNED",
      "parent_stage_id": "AI-GOV-AUTOMATION-100",
      "release_train": "builder-beta",
      "depends_on": ["SYS-AI-RUN-MANIFEST", "SYS-AI-TEST-INTEGRITY"],
      "security": {"risk": "critical", "threat_model_required": true},
      "acceptance_criteria": ["AI-authored PASS prose cannot satisfy machine/runtime/provider evidence gates and promoted artifacts remain traceable to exact source/build inputs."]
    },
    {
      "id": "SYS-AI-REVIEW-INDEPENDENCE",
      "type": "core-system",
      "name": "Independent Review Enforcement",
      "summary": "Bind reviewer identity/role to exact reviewed SHA and invalidate stale approvals after material changes.",
      "status": "PLANNED",
      "parent_stage_id": "AI-GOV-AUTOMATION-100",
      "release_train": "builder-beta",
      "depends_on": ["SYS-EVIDENCE-ATTESTATION"],
      "security": {"risk": "high", "threat_model_required": true},
      "acceptance_criteria": ["High/critical work cannot count author self-review or approval of an older head as independent evidence."]
    },
    {
      "id": "SYS-AI-ATTEMPT-CIRCUIT",
      "type": "core-system",
      "name": "AI Retry / Attempt Circuit Breaker",
      "summary": "Bound repeated failing strategies, tool/build loops and cost/resource consumption without weakening controls to escape failure.",
      "status": "PLANNED",
      "parent_stage_id": "AI-GOV-AUTOMATION-100",
      "release_train": "builder-beta",
      "depends_on": ["SYS-AI-RUN-MANIFEST"],
      "security": {"risk": "moderate", "threat_model_required": false},
      "acceptance_criteria": ["Repeated equivalent failures stop into evidence-backed re-analysis/blocker state rather than infinite retries or disabled validation."]
    },
    {
      "id": "SYS-AI-MULTIAGENT-COORDINATION",
      "type": "core-system",
      "name": "Multi-Agent Task DAG & Merge Coordination",
      "summary": "Partition parallel work with subset capabilities, dependency DAG, isolated writes and exact-head integrated verification.",
      "status": "PLANNED",
      "parent_stage_id": "AI-GOV-AUTOMATION-100",
      "release_train": "builder-beta",
      "depends_on": ["SYS-AI-SCOPE-LEASE", "SYS-AI-REVIEW-INDEPENDENCE"],
      "security": {"risk": "high", "threat_model_required": true},
      "acceptance_criteria": ["Child agents cannot escalate parent authority and child completion never substitutes for integrated combined-head verification."]
    },
    {
      "id": "SEC-AI-WAIVER-GOVERNANCE",
      "type": "security-control",
      "name": "AI Development Waiver Governance",
      "summary": "Stable scoped expiring waivers with approver authority and compensating controls instead of silent N/A/bypass behavior.",
      "status": "PLANNED",
      "parent_stage_id": "AI-GOV-AUTOMATION-100",
      "release_train": "builder-beta",
      "depends_on": ["SEC-AI-GOVERNANCE-SELF-PROTECTION"],
      "security": {"risk": "high", "threat_model_required": true},
      "acceptance_criteria": ["Expired, self-approved or over-broad material waivers fail closed and are visible in release evidence."]
    },
    {
      "id": "SYS-AI-DEPENDENCY-INTAKE",
      "type": "core-system",
      "name": "AI Dependency Intake",
      "summary": "Require purpose, identity, lockfile, license, advisories, provenance, install-script, transitive, runtime/bundle and rollback review for dependency changes.",
      "status": "PLANNED",
      "parent_stage_id": "AI-GOV-AUTOMATION-100",
      "release_train": "builder-beta",
      "depends_on": ["SYS-AI-EXECUTION-SANDBOX"],
      "security": {"risk": "high", "threat_model_required": true},
      "acceptance_criteria": ["AI cannot add a dependency solely because it is convenient or green-builds; supply-chain and compatibility impact are explicit."]
    },
    {
      "id": "SEC-AI-DEV-REDTEAM",
      "type": "security-control",
      "name": "AI Development Adversarial Evaluation",
      "summary": "Prompt-injection, evidence-forgery, self-weakening, stale-context, scope-escalation, multi-agent race and secret/network abuse fixtures for the development agent pipeline.",
      "status": "PLANNED",
      "parent_stage_id": "AI-GOV-AUTOMATION-100",
      "release_train": "builder-beta",
      "depends_on": ["SYS-AI-INSTRUCTION-TRUST", "SEC-AI-GOVERNANCE-SELF-PROTECTION", "SYS-EVIDENCE-ATTESTATION", "SYS-AI-MULTIAGENT-COORDINATION"],
      "security": {"risk": "critical", "threat_model_required": true},
      "acceptance_criteria": ["Representative agentic abuse cases are blocked or safely stopped with auditable evidence before autonomous high-risk development is trusted."]
    }
  ]
}